433,2017-03-28T14:08:56Z,2017-03-25T06:18:38Z,http://arxiv.org/abs/1703.08653v1,http://arxiv.org/pdf/1703.08653v1,Bayesian Optimization for Refining Object Proposals,bayesian optim refin object propos,"We develop a general-purpose algorithm using a Bayesian optimization framework for the efficient refinement of object proposals. While recent research has achieved substantial progress for object localization and related objectives in computer vision, current state-of-the-art object localization procedures are nevertheless encumbered by inefficiency and inaccuracy. We present a novel, computationally efficient method for refining inaccurate bounding-box proposals for a target object using Bayesian optimization. Offline, image features from a convolutional neural network are used to train a model to predict the offset distance of an object proposal from a target object. Online, this model is used in a Bayesian active search to improve inaccurate object proposals. In experiments, we compare our approach to a state-of-the-art bounding-box regression method for localization refinement of pedestrian object proposals. Our method exhibits a substantial improvement for the task of localization refinement over this baseline regression method.",develop general purpos algorithm use bayesian optim framework effici refin object propos recent research achiev substanti progress object local relat object comput vision current state art object local procedur nevertheless encumb ineffici inaccuraci present novel comput effici method refin inaccur bound box propos target object use bayesian optim offlin imag featur convolut neural network use train model predict offset distanc object propos target object onlin model use bayesian activ search improv inaccur object propos experi compar approach state art bound box regress method local refin pedestrian object propos method exhibit substanti improv task local refin baselin regress method,"['Anthony D. Rhodes', 'Jordan Witte', 'Melanie Mitchell', 'Bruno Jedynak']",['cs.CV'],True,False,False,True,False,False
435,2017-03-28T14:08:56Z,2017-03-24T23:50:52Z,http://arxiv.org/abs/1703.08628v1,http://arxiv.org/pdf/1703.08628v1,AMAT: Medial Axis Transform for Natural Images,amat medial axi transform natur imag,"The medial axis transform (MAT) is a powerful shape abstraction that has been successfully used in shape editing, matching and retrieval. Despite its long history, the MAT has not found widespread use in tasks involving natural images, due to the lack of a generalization that accommodates color and texture. In this paper we introduce Appearance-MAT (AMAT), by framing the MAT of natural images as a weighted geometric set cover problem. We make the following contributions: i) we extend previous medial point detection methods for color images, by associating each medial point with a local scale; ii) inspired by the invertibility property of the binary MAT, we also associate each medial point with a local encoding that allows us to invert the AMAT, reconstructing the input image; iii) we describe a clustering scheme that takes advantage of the additional scale and appearance information to group individual points into medial branches, providing a shape decomposition of the underlying image regions. In our experiments, we show state-of-the-art performance in medial point detection on Berkeley Medial AXes (BMAX500), a new dataset of medial axes based on the established BSDS500 database. We also measure the quality of reconstructed images from the same dataset, obtained by inverting their computed AMAT. Our approach delivers significantly better reconstruction quality with respect to three baselines, using just 10% of the image pixels. Our code is available at https://github.com/tsogkas/amat.",medial axi transform mat power shape abstract success use shape edit match retriev despit long histori mat found widespread use task involv natur imag due lack general accommod color textur paper introduc appear mat amat frame mat natur imag weight geometr set cover problem make follow contribut extend previous medial point detect method color imag associ medial point local scale ii inspir invert properti binari mat also associ medial point local encod allow us invert amat reconstruct input imag iii describ cluster scheme take advantag addit scale appear inform group individu point medial branch provid shape decomposit imag region experi show state art perform medial point detect berkeley medial axe bmax new dataset medial axe base establish bsds databas also measur qualiti reconstruct imag dataset obtain invert comput amat approach deliv signific better reconstruct qualiti respect three baselin use imag pixel code avail https github com tsogka amat,"['Stavros Tsogkas', 'Sven Dickinson']",['cs.CV'],False,False,False,True,False,False
437,2017-03-28T14:08:56Z,2017-03-24T21:26:16Z,http://arxiv.org/abs/1703.08603v1,http://arxiv.org/pdf/1703.08603v1,Adversarial Examples for Semantic Segmentation and Object Detection,adversari exampl semant segment object detect,"It has been well demonstrated that adversarial examples, i.e., natural images with visually imperceptible perturbations added, generally exist for deep networks to fail on image classification. In this paper, we extend adversarial examples to semantic segmentation and object detection which are much more difficult. Our observation is that both segmentation and detection are based on classifying multiple targets on an image (e.g., the basic target is a pixel or a receptive field in segmentation, and an object proposal in detection), which inspires us to optimize a loss function over a set of pixels/proposals for generating adversarial perturbations. Based on this idea, we propose a novel algorithm named Dense Adversary Generation (DAG), which generates a large family of adversarial examples, and applies to a wide range of state-of-the-art deep networks for segmentation and detection. We also find that the adversarial perturbations can be transferred across networks with different training data, based on different architectures, and even for different recognition tasks. In particular, the transferability across networks with the same architecture is more significant than in other cases. Besides, summing up heterogeneous perturbations often leads to better transfer performance, which provides an effective method of black-box adversarial attack.",well demonstr adversari exampl natur imag visual impercept perturb ad general exist deep network fail imag classif paper extend adversari exampl semant segment object detect much difficult observ segment detect base classifi multipl target imag basic target pixel recept field segment object propos detect inspir us optim loss function set pixel propos generat adversari perturb base idea propos novel algorithm name dens adversari generat dag generat larg famili adversari exampl appli wide rang state art deep network segment detect also find adversari perturb transfer across network differ train data base differ architectur even differ recognit task particular transfer across network architectur signific case besid sum heterogen perturb often lead better transfer perform provid effect method black box adversari attack,"['Cihang Xie', 'Jianyu Wang', 'Zhishuai Zhang', 'Yuyin Zhou', 'Lingxi Xie', 'Alan Yuille']",['cs.CV'],False,False,False,True,False,False
440,2017-03-28T14:09:00Z,2017-03-24T16:41:19Z,http://arxiv.org/abs/1703.08497v1,http://arxiv.org/pdf/1703.08497v1,Local Deep Neural Networks for Age and Gender Classification,local deep neural network age gender classif,"Local deep neural networks have been recently introduced for gender recognition. Although, they achieve very good performance they are very computationally expensive to train. In this work, we introduce a simplified version of local deep neural networks which significantly reduces the training time. Instead of using hundreds of patches per image, as suggested by the original method, we propose to use 9 overlapping patches per image which cover the entire face region. This results in a much reduced training time, since just 9 patches are extracted per image instead of hundreds, at the expense of a slightly reduced performance. We tested the proposed modified local deep neural networks approach on the LFW and Adience databases for the task of gender and age classification. For both tasks and both databases the performance is up to 1% lower compared to the original version of the algorithm. We have also investigated which patches are more discriminative for age and gender classification. It turns out that the mouth and eyes regions are useful for age classification, whereas just the eye region is useful for gender classification.",local deep neural network recent introduc gender recognit although achiev veri good perform veri comput expens train work introduc simplifi version local deep neural network signific reduc train time instead use hundr patch per imag suggest origin method propos use overlap patch per imag cover entir face region result much reduc train time sinc patch extract per imag instead hundr expens slight reduc perform test propos modifi local deep neural network approach lfw adienc databas task gender age classif task databas perform lower compar origin version algorithm also investig patch discrimin age gender classif turn mouth eye region use age classif wherea eye region use gender classif,"['Zukang Liao', 'Stavros Petridis', 'Maja Pantic']",['cs.CV'],False,False,False,True,False,False
442,2017-03-28T14:09:00Z,2017-03-24T16:27:57Z,http://arxiv.org/abs/1703.08492v1,http://arxiv.org/pdf/1703.08492v1,Content-Based Image Retrieval Based on Late Fusion of Binary and Local   Descriptors,content base imag retriev base late fusion binari local descriptor,"One of the challenges in Content-Based Image Retrieval (CBIR) is to reduce the semantic gaps between low-level features and high-level semantic concepts. In CBIR, the images are represented in the feature space and the performance of CBIR depends on the type of selected feature representation. Late fusion also known as visual words integration is applied to enhance the performance of image retrieval. The recent advances in image retrieval diverted the focus of research towards the use of binary descriptors as they are reported computationally efficient. In this paper, we aim to investigate the late fusion of Fast Retina Keypoint (FREAK) and Scale Invariant Feature Transform (SIFT). The late fusion of binary and local descriptor is selected because among binary descriptors, FREAK has shown good results in classification-based problems while SIFT is robust to translation, scaling, rotation and small distortions. The late fusion of FREAK and SIFT integrates the performance of both feature descriptors for an effective image retrieval. Experimental results and comparisons show that the proposed late fusion enhances the performances of image retrieval.",one challeng content base imag retriev cbir reduc semant gap low level featur high level semant concept cbir imag repres featur space perform cbir depend type select featur represent late fusion also known visual word integr appli enhanc perform imag retriev recent advanc imag retriev divert focus research toward use binari descriptor report comput effici paper aim investig late fusion fast retina keypoint freak scale invari featur transform sift late fusion binari local descriptor select becaus among binari descriptor freak shown good result classif base problem sift robust translat scale rotat small distort late fusion freak sift integr perform featur descriptor effect imag retriev experiment result comparison show propos late fusion enhanc perform imag retriev,"['Nouman Ali', 'Danish Ali Mazhar', 'Zeshan Iqbal', 'Rehan Ashraf', 'Jawad Ahmed', 'Farrukh Zeeshan Khan']",['cs.CV'],False,True,False,True,False,False
443,2017-03-28T14:09:00Z,2017-03-24T15:41:01Z,http://arxiv.org/abs/1703.08472v1,http://arxiv.org/pdf/1703.08472v1,Medical Image Retrieval using Deep Convolutional Neural Network,medic imag retriev use deep convolut neural network,"With a widespread use of digital imaging data in hospitals, the size of medical image repositories is increasing rapidly. This causes difficulty in managing and querying these large databases leading to the need of content based medical image retrieval (CBMIR) systems. A major challenge in CBMIR systems is the semantic gap that exists between the low level visual information captured by imaging devices and high level semantic information perceived by human. The efficacy of such systems is more crucial in terms of feature representations that can characterize the high-level information completely. In this paper, we propose a framework of deep learning for CBMIR system by using deep Convolutional Neural Network (CNN) that is trained for classification of medical images. An intermodal dataset that contains twenty four classes and five modalities is used to train the network. The learned features and the classification results are used to retrieve medical images. For retrieval, best results are achieved when class based predictions are used. An average classification accuracy of 99.77% and a mean average precision of 0.69 is achieved for retrieval task. The proposed method is best suited to retrieve multimodal medical images for different body organs.",widespread use digit imag data hospit size medic imag repositori increas rapid caus difficulti manag queri larg databas lead need content base medic imag retriev cbmir system major challeng cbmir system semant gap exist low level visual inform captur imag devic high level semant inform perceiv human efficaci system crucial term featur represent character high level inform complet paper propos framework deep learn cbmir system use deep convolut neural network cnn train classif medic imag intermod dataset contain twenti four class five modal use train network learn featur classif result use retriev medic imag retriev best result achiev class base predict use averag classif accuraci mean averag precis achiev retriev task propos method best suit retriev multimod medic imag differ bodi organ,"['Adnan Qayyum', 'Syed Muhammad Anwar', 'Muhammad Awais', 'Muhammad Majid']",['cs.CV'],False,False,False,True,False,False
444,2017-03-28T14:09:00Z,2017-03-27T07:23:05Z,http://arxiv.org/abs/1703.08448v2,http://arxiv.org/pdf/1703.08448v2,Object Region Mining with Adversarial Erasing: A Simple Classification   to Semantic Segmentation Approach,object region mine adversari eras simpl classif semant segment approach,"We investigate a principle way to progressively mine discriminative object regions using classification networks to address the weakly-supervised semantic segmentation problems. Classification networks are only responsive to small and sparse discriminative regions from the object of interest, which deviates from the requirement of the segmentation task that needs to localize dense, interior and integral regions for pixel-wise inference. To mitigate this gap, we propose a new adversarial erasing approach for localizing and expanding object regions progressively. Starting with a single small object region, our proposed approach drives the classification network to sequentially discover new and complement object regions by erasing the current mined regions in an adversarial manner. These localized regions eventually constitute a dense and complete object region for learning semantic segmentation. To further enhance the quality of the discovered regions by adversarial erasing, an online prohibitive segmentation learning approach is developed to collaborate with adversarial erasing by providing auxiliary segmentation supervision modulated by the more reliable classification scores. Despite its apparent simplicity, the proposed approach achieves 55.0% and 55.7% mean Intersection-over-Union (mIoU) scores on PASCAL VOC 2012 val and test sets, which are the new state-of-the-arts.",investig principl way progress mine discrimin object region use classif network address weak supervis semant segment problem classif network onli respons small spars discrimin region object interest deviat requir segment task need local dens interior integr region pixel wise infer mitig gap propos new adversari eras approach local expand object region progress start singl small object region propos approach drive classif network sequenti discov new complement object region eras current mine region adversari manner local region eventu constitut dens complet object region learn semant segment enhanc qualiti discov region adversari eras onlin prohibit segment learn approach develop collabor adversari eras provid auxiliari segment supervis modul reliabl classif score despit appar simplic propos approach achiev mean intersect union miou score pascal voc val test set new state art,"['Yunchao Wei', 'Jiashi Feng', 'Xiaodan Liang', 'Ming-Ming Cheng', 'Yao Zhao', 'Shuicheng Yan']",['cs.CV'],False,False,False,True,False,False
446,2017-03-28T14:09:00Z,2017-03-24T11:58:14Z,http://arxiv.org/abs/1703.08378v1,http://arxiv.org/pdf/1703.08378v1,Feature Fusion using Extended Jaccard Graph and Stochastic Gradient   Descent for Robot,featur fusion use extend jaccard graph stochast gradient descent robot,"Robot vision is a fundamental device for human-robot interaction and robot complex tasks. In this paper, we use Kinect and propose a feature graph fusion (FGF) for robot recognition. Our feature fusion utilizes RGB and depth information to construct fused feature from Kinect. FGF involves multi-Jaccard similarity to compute a robust graph and utilize word embedding method to enhance the recognition results. We also collect DUT RGB-D face dataset and a benchmark datset to evaluate the effectiveness and efficiency of our method. The experimental results illustrate FGF is robust and effective to face and object datasets in robot applications.",robot vision fundament devic human robot interact robot complex task paper use kinect propos featur graph fusion fgf robot recognit featur fusion util rgb depth inform construct fuse featur kinect fgf involv multi jaccard similar comput robust graph util word embed method enhanc recognit result also collect dut rgb face dataset benchmark datset evalu effect effici method experiment result illustr fgf robust effect face object dataset robot applic,"['Shenglan Liu', 'Muxin Sun', 'Wei Wang', 'Feilong Wang']","['cs.CV', 'cs.LG', 'cs.RO']",False,False,False,True,False,False
450,2017-03-28T14:09:05Z,2017-03-24T05:54:11Z,http://arxiv.org/abs/1703.08289v1,http://arxiv.org/pdf/1703.08289v1,Deep Direct Regression for Multi-Oriented Scene Text Detection,deep direct regress multi orient scene text detect,"In this paper, we first provide a new perspective to divide existing high performance object detection methods into direct and indirect regressions. Direct regression performs boundary regression by predicting the offsets from a given point, while indirect regression predicts the offsets from some bounding box proposals. Then we analyze the drawbacks of the indirect regression, which the recent state-of-the-art detection structures like Faster-RCNN and SSD follows, for multi-oriented scene text detection, and point out the potential superiority of direct regression. To verify this point of view, we propose a deep direct regression based method for multi-oriented scene text detection. Our detection framework is simple and effective with a fully convolutional network and one-step post processing. The fully convolutional network is optimized in an end-to-end way and has bi-task outputs where one is pixel-wise classification between text and non-text, and the other is direct regression to determine the vertex coordinates of quadrilateral text boundaries. The proposed method is particularly beneficial for localizing incidental scene texts. On the ICDAR2015 Incidental Scene Text benchmark, our method achieves the F1-measure of 81%, which is a new state-of-the-art and significantly outperforms previous approaches. On other standard datasets with focused scene texts, our method also reaches the state-of-the-art performance.",paper first provid new perspect divid exist high perform object detect method direct indirect regress direct regress perform boundari regress predict offset given point indirect regress predict offset bound box propos analyz drawback indirect regress recent state art detect structur like faster rcnn ssd follow multi orient scene text detect point potenti superior direct regress verifi point view propos deep direct regress base method multi orient scene text detect detect framework simpl effect fulli convolut network one step post process fulli convolut network optim end end way bi task output one pixel wise classif text non text direct regress determin vertex coordin quadrilater text boundari propos method particular benefici local incident scene text icdar incident scene text benchmark method achiev measur new state art signific outperform previous approach standard dataset focus scene text method also reach state art perform,"['Wenhao He', 'Xu-Yao Zhang', 'Fei Yin', 'Cheng-Lin Liu']",['cs.CV'],True,False,False,True,False,False
460,2017-03-28T14:09:09Z,2017-03-23T12:19:09Z,http://arxiv.org/abs/1703.08033v1,http://arxiv.org/pdf/1703.08033v1,Generative Adversarial Residual Pairwise Networks for One Shot Learning,generat adversari residu pairwis network one shot learn,"Deep neural networks achieve unprecedented performance levels over many tasks and scale well with large quantities of data, but performance in the low-data regime and tasks like one shot learning still lags behind. While recent work suggests many hypotheses from better optimization to more complicated network structures, in this work we hypothesize that having a learnable and more expressive similarity objective is an essential missing component. Towards overcoming that, we propose a network design inspired by deep residual networks that allows the efficient computation of this more expressive pairwise similarity objective. Further, we argue that regularization is key in learning with small amounts of data, and propose an additional generator network based on the Generative Adversarial Networks where the discriminator is our residual pairwise network. This provides a strong regularizer by leveraging the generated data samples. The proposed model can generate plausible variations of exemplars over unseen classes and outperforms strong discriminative baselines for few shot classification tasks. Notably, our residual pairwise network design outperforms previous state-of-theart on the challenging mini-Imagenet dataset for one shot learning by getting over 55% accuracy for the 5-way classification task over unseen classes.",deep neural network achiev unpreced perform level mani task scale well larg quantiti data perform low data regim task like one shot learn still lag behind recent work suggest mani hypothes better optim complic network structur work hypothes learnabl express similar object essenti miss compon toward overcom propos network design inspir deep residu network allow effici comput express pairwis similar object argu regular key learn small amount data propos addit generat network base generat adversari network discrimin residu pairwis network provid strong regular leverag generat data sampl propos model generat plausibl variat exemplar unseen class outperform strong discrimin baselin shot classif task notabl residu pairwis network design outperform previous state theart challeng mini imagenet dataset one shot learn get accuraci way classif task unseen class,"['Akshay Mehrotra', 'Ambedkar Dukkipati']","['cs.CV', 'cs.NE']",False,False,False,True,False,False
464,2017-03-28T14:09:09Z,2017-03-23T11:02:42Z,http://arxiv.org/abs/1703.08001v1,http://arxiv.org/pdf/1703.08001v1,Nonlinear Spectral Image Fusion,nonlinear spectral imag fusion,"In this paper we demonstrate that the framework of nonlinear spectral decompositions based on total variation (TV) regularization is very well suited for image fusion as well as more general image manipulation tasks. The well-localized and edge-preserving spectral TV decomposition allows to select frequencies of a certain image to transfer particular features, such as wrinkles in a face, from one image to another. We illustrate the effectiveness of the proposed approach in several numerical experiments, including a comparison to the competing techniques of Poisson image editing, linear osmosis, wavelet fusion and Laplacian pyramid fusion. We conclude that the proposed spectral TV image decomposition framework is a valuable tool for semi- and fully-automatic image editing and fusion.",paper demonstr framework nonlinear spectral decomposit base total variat tv regular veri well suit imag fusion well general imag manipul task well local edg preserv spectral tv decomposit allow select frequenc certain imag transfer particular featur wrinkl face one imag anoth illustr effect propos approach sever numer experi includ comparison compet techniqu poisson imag edit linear osmosi wavelet fusion laplacian pyramid fusion conclud propos spectral tv imag decomposit framework valuabl tool semi fulli automat imag edit fusion,"['Martin Benning', 'Michael Möller', 'Raz Z. Nossek', 'Martin Burger', 'Daniel Cremers', 'Guy Gilboa', 'Carola-Bibiane Schönlieb']","['cs.CV', 'math.NA', '35P30, 62H35, 65M70, 94A08', 'G.1.3; G.1.6; G.1.8; I.4.0; I.4.5']",False,False,False,True,False,False
