492,2017-03-28T14:09:21Z,2017-03-23T21:37:40Z,http://arxiv.org/abs/1703.07478v2,http://arxiv.org/pdf/1703.07478v2,Spatially-Varying Blur Detection Based on Multiscale Fused and Sorted   Transform Coefficients of Gradient Magnitudes,spatial vari blur detect base multiscal fuse sort transform coeffici gradient magnitud,"The detection of spatially-varying blur without having any information about the blur type is a challenging task. In this paper, we propose a novel effective approach to address the blur detection problem from a single image without requiring any knowledge about the blur type, level, or camera settings. Our approach computes blur detection maps based on a novel High-frequency multiscale Fusion and Sort Transform (HiFST) of gradient magnitudes. The evaluations of the proposed approach on a diverse set of blurry images with different blur types, levels, and contents demonstrate that the proposed algorithm performs favorably against the state-of-the-art methods qualitatively and quantitatively.",detect spatial vari blur without ani inform blur type challeng task paper propos novel effect approach address blur detect problem singl imag without requir ani knowledg blur type level camera set approach comput blur detect map base novel high frequenc multiscal fusion sort transform hifst gradient magnitud evalu propos approach divers set blurri imag differ blur type level content demonstr propos algorithm perform favor state art method qualit quantit,"['S. Alireza Golestaneh', 'Lina J. Karam']",['cs.CV'],False,False,False,True,False,False
498,2017-03-28T14:09:21Z,2017-03-21T17:41:46Z,http://arxiv.org/abs/1703.07334v1,http://arxiv.org/pdf/1703.07334v1,Pop-up SLAM: Semantic Monocular Plane SLAM for Low-texture Environments,pop slam semant monocular plane slam low textur environ,"Existing simultaneous localization and mapping (SLAM) algorithms are not robust in challenging low-texture environments because there are only few salient features. The resulting sparse or semi-dense map also conveys little information for motion planning. Though some work utilize plane or scene layout for dense map regularization, they require decent state estimation from other sources. In this paper, we propose real-time monocular plane SLAM to demonstrate that scene understanding could improve both state estimation and dense mapping especially in low-texture environments. The plane measurements come from a pop-up 3D plane model applied to each single image. We also combine planes with point based SLAM to improve robustness. On a public TUM dataset, our algorithm generates a dense semantic 3D model with pixel depth error of 6.2 cm while existing SLAM algorithms fail. On a 60 m long dataset with loops, our method creates a much better 3D model with state estimation error of 0.67%.",exist simultan local map slam algorithm robust challeng low textur environ becaus onli salient featur result spars semi dens map also convey littl inform motion plan though work util plane scene layout dens map regular requir decent state estim sourc paper propos real time monocular plane slam demonstr scene understand could improv state estim dens map especi low textur environ plane measur come pop plane model appli singl imag also combin plane point base slam improv robust public tum dataset algorithm generat dens semant model pixel depth error cm exist slam algorithm fail long dataset loop method creat much better model state estim error,"['Shichao Yang', 'Yu Song', 'Michael Kaess', 'Sebastian Scherer']","['cs.CV', 'cs.RO']",False,False,False,True,False,False
499,2017-03-28T14:09:21Z,2017-03-21T17:37:36Z,http://arxiv.org/abs/1703.07332v1,http://arxiv.org/pdf/1703.07332v1,"How far are we from solving the 2D & 3D Face Alignment problem? (and a   dataset of 230,000 3D facial landmarks)",far solv face align problem dataset facial landmark,"This paper investigates how far a very deep neural network is from attaining close to saturating performance on existing 2D and 3D face alignment datasets. To this end, we make the following three contributions: (a) we construct, for the first time, a very strong baseline by combining a state-of-the-art architecture for landmark localization with a state-of-the-art residual block, train it on a very large yet synthetically expanded 2D facial landmark dataset and finally evaluate it on all other 2D facial landmark datasets. (b) We create a guided by 2D landmarks network which converts 2D landmark annotations to 3D and unifies all existing datasets, leading to the creation of LS3D-W, the largest and most challenging 3D facial landmark dataset to date (~230,000 images). (c) Following that, we train a neural network for 3D face alignment and evaluate it on the newly introduced LS3D-W. (d) We further look into the effect of all ""traditional"" factors affecting face alignment performance like large pose, initialization and resolution, and introduce a ""new"" one, namely the size of the network. (e) We show that both 2D and 3D face alignment networks achieve performance of remarkable accuracy which is probably close to saturating the datasets used. Demo code and pre-trained models can be downloaded from http://www.cs.nott.ac.uk/~psxab5/face-alignment/",paper investig far veri deep neural network attain close satur perform exist face align dataset end make follow three contribut construct first time veri strong baselin combin state art architectur landmark local state art residu block train veri larg yet synthet expand facial landmark dataset final evalu facial landmark dataset creat guid landmark network convert landmark annot unifi exist dataset lead creation lsd largest challeng facial landmark dataset date imag follow train neural network face align evalu newli introduc lsd look effect tradit factor affect face align perform like larg pose initi resolut introduc new one name size network show face align network achiev perform remark accuraci probabl close satur dataset use demo code pre train model download http www cs nott ac uk psxab face align,"['Adrian Bulat', 'Georgios Tzimiropoulos']",['cs.CV'],False,False,False,True,False,False
868,2017-03-28T14:11:17Z,2016-12-15T14:16:56Z,http://arxiv.org/abs/1612.05076v1,http://arxiv.org/pdf/1612.05076v1,Live Score Following on Sheet Music Images,live score follow sheet music imag,"In this demo we show a novel approach to score following. Instead of relying on some symbolic representation, we are using a multi-modal convolutional neural network to match the incoming audio stream directly to sheet music images. This approach is in an early stage and should be seen as proof of concept. Nonetheless, the audience will have the opportunity to test our implementation themselves via 3 simple piano pieces.",demo show novel approach score follow instead reli symbol represent use multi modal convolut neural network match incom audio stream direct sheet music imag approach earli stage seen proof concept nonetheless audienc opportun test implement themselv via simpl piano piec,"['Matthias Dorfer', 'Andreas Arzt', 'Sebastian Böck', 'Amaury Durand', 'Gerhard Widmer']",['cs.SD'],False,False,False,True,False,False
920,2017-03-28T14:02:35Z,2017-03-20T19:45:39Z,http://arxiv.org/abs/1703.06946v1,http://arxiv.org/pdf/1703.06946v1,SCALPEL: Extracting Neurons from Calcium Imaging Data,scalpel extract neuron calcium imag data,"In the past few years, new technologies in the field of neuroscience have made it possible to simultaneously image activity in large populations of neurons at cellular resolution in behaving animals. In mid-2016, a huge repository of this so-called ""calcium imaging"" data was made publicly-available. The availability of this large-scale data resource opens the door to a host of scientific questions, for which new statistical methods must be developed.   In this paper, we consider the first step in the analysis of calcium imaging data: namely, identifying the neurons in a calcium imaging video. We propose a dictionary learning approach for this task. First, we perform image segmentation to develop a dictionary containing a huge number of candidate neurons. Next, we refine the dictionary using clustering. Finally, we apply the dictionary in order to select neurons and estimate their corresponding activity over time, using a sparse group lasso optimization problem. We apply our proposal to three calcium imaging data sets.   Our proposed approach is implemented in the R package scalpel, which is available on CRAN.",past year new technolog field neurosci made possibl simultan imag activ larg popul neuron cellular resolut behav anim mid huge repositori call calcium imag data made public avail avail larg scale data resourc open door host scientif question new statist method must develop paper consid first step analysi calcium imag data name identifi neuron calcium imag video propos dictionari learn approach task first perform imag segment develop dictionari contain huge number candid neuron next refin dictionari use cluster final appli dictionari order select neuron estim correspond activ time use spars group lasso optim problem appli propos three calcium imag data set propos approach implement packag scalpel avail cran,"['Ashley Petersen', 'Noah Simon', 'Daniela Witten']","['stat.AP', 'q-bio.NC']",False,False,False,True,False,False
937,2017-03-28T14:02:39Z,2017-03-15T17:03:56Z,http://arxiv.org/abs/1703.05264v1,http://arxiv.org/pdf/1703.05264v1,Smooth Image-on-Scalar Regression for Brain Mapping,smooth imag scalar regress brain map,"Brain mapping is an increasingly important tool in neurology and psychiatry researches for the realization of data-driven personalized medicine in the big data era, which learns the statistical links between brain images and subject level features. Taking images as responses, the task raises a lot of challenges due to the high dimensionality of the image with relatively small number of samples, as well as the noisiness of measurements in medical images.   In this paper we propose a novel method {\it Smooth Image-on-scalar Regression} (SIR) for recovering the true association between an image outcome and scalar predictors. The estimator is achieved by minimizing a mean squared error with a total variation (TV) regularization term on the predicted mean image across all subjects. It denoises the images from all subjects and at the same time returns the coefficient maps estimation. We propose an algorithm to solve this optimization problem, which is efficient when combined with recent advances in graph fused lasso solvers. The statistical consistency of the estimator is shown via an oracle inequality.   Simulation results demonstrate that the proposed method outperforms existing methods with separate denoising and regression steps. Especially, SIR shows an evident advantage in recovering signals in small regions. We apply SIR on Alzheimer's Disease Neuroimaging Initiative data and produce interpretable brain maps of the PET image to patient-level features include age, gender, genotype and disease groups.",brain map increas import tool neurolog psychiatri research realize data driven person medicin big data era learn statist link brain imag subject level featur take imag respons task rais lot challeng due high dimension imag relat small number sampl well noisi measur medic imag paper propos novel method smooth imag scalar regress sir recov true associ imag outcom scalar predictor estim achiev minim mean squar error total variat tv regular term predict mean imag across subject denois imag subject time return coeffici map estim propos algorithm solv optim problem effici combin recent advanc graph fuse lasso solver statist consist estim shown via oracl inequ simul result demonstr propos method outperform exist method separ denois regress step especi sir show evid advantag recov signal small region appli sir alzheim diseas neuroimag initi data produc interpret brain map pet imag patient level featur includ age gender genotyp diseas group,"['Ying Liu', 'Bowei Yan']","['stat.ME', 'stat.AP']",False,False,False,True,False,False
949,2017-03-28T14:02:44Z,2017-03-10T22:46:09Z,http://arxiv.org/abs/1703.03862v1,http://arxiv.org/pdf/1703.03862v1,Joint Embedding of Graphs,joint embed graph,"Feature extraction and dimension reduction for networks is critical in a wide variety of domains. Efficiently and accurately learning features for multiple graphs has important applications in statistical inference on graphs. We propose a method to jointly embed multiple undirected graphs. Given a set of graphs, the joint embedding method identifies a linear subspace spanned by rank one symmetric matrices and projects adjacency matrices of graphs into this subspace. The projection coefficients can be treated as features of the graphs. We also propose a random graph model which generalizes classical random graph model and can be used to model multiple graphs. We show through theory and numerical experiments that under the model, the joint embedding method produces estimates of parameters with small errors. Via simulation experiments, we demonstrate that the joint embedding method produces features which lead to state of the art performance in classifying graphs. Applying the joint embedding method to human brain graphs, we find it extract interpretable features that can be used to predict individual composite creativity index.",featur extract dimens reduct network critic wide varieti domain effici accur learn featur multipl graph import applic statist infer graph propos method joint emb multipl undirect graph given set graph joint embed method identifi linear subspac span rank one symmetr matric project adjac matric graph subspac project coeffici treat featur graph also propos random graph model general classic random graph model use model multipl graph show theori numer experi model joint embed method produc estim paramet small error via simul experi demonstr joint embed method produc featur lead state art perform classifi graph appli joint embed method human brain graph find extract interpret featur use predict individu composit creativ index,"['Shangsi Wang', 'Joshua T. Vogelstein', 'Carey E. Priebe']","['stat.AP', 'cs.LG', 'stat.ML']",False,False,False,True,False,False
998,2017-03-28T14:03:04Z,2017-02-19T10:08:16Z,http://arxiv.org/abs/1702.05732v1,http://arxiv.org/pdf/1702.05732v1,Low-dose cryo electron ptychography via non-convex Bayesian optimization,low dose cryo electron ptychographi via non convex bayesian optim,"Electron ptychography has seen a recent surge of interest for phase sensitive imaging at atomic or near-atomic resolution. However, applications are so far mainly limited to radiation-hard samples because the required doses are too high for imaging biological samples at high resolution. We propose the use of non-convex, Bayesian optimization to overcome this problem and reduce the dose required for successful reconstruction by two orders of magnitude compared to previous experiments. We suggest to use this method for imaging single biological macromolecules at cryogenic temperatures and demonstrate 2D single-particle reconstructions from simulated data with a resolution of 7.9 \AA$\,$ at a dose of 20 $e^- / \AA^2$. When averaging over only 15 low-dose datasets, a resolution of 4 \AA$\,$ is possible for large macromolecular complexes. With its independence from microscope transfer function, direct recovery of phase contrast and better scaling of signal-to-noise ratio, cryo-electron ptychography may become a promising alternative to Zernike phase-contrast microscopy.",electron ptychographi seen recent surg interest phase sensit imag atom near atom resolut howev applic far main limit radiat hard sampl becaus requir dose high imag biolog sampl high resolut propos use non convex bayesian optim overcom problem reduc dose requir success reconstruct two order magnitud compar previous experi suggest use method imag singl biolog macromolecul cryogen temperatur demonstr singl particl reconstruct simul data resolut aa dose aa averag onli low dose dataset resolut aa possibl larg macromolecular complex independ microscop transfer function direct recoveri phase contrast better scale signal nois ratio cryo electron ptychographi may becom promis altern zernik phase contrast microscopi,"['Philipp Michael Pelz', 'Wen Xuan Qiu', 'Robert Bücker', 'Günther Kassier', 'R. J. Dwayne Miller']","['physics.comp-ph', 'math.OC', 'physics.data-an', 'stat.AP']",False,False,False,True,False,False
1073,2017-03-28T14:03:38Z,2017-02-17T18:06:27Z,http://arxiv.org/abs/1702.05462v1,http://arxiv.org/pdf/1702.05462v1,Objective Bayesian Analysis for Change Point Problems,object bayesian analysi chang point problem,"In this paper we present an objective approach to change point analysis. In particular, we look at the problem from two perspectives. The first focuses on the definition of an objective prior when the number of change points is known a priori. The second contribution aims to estimate the number of change points by using an objective approach, recently introduced in the literature, based on losses. The latter considers change point estimation as a model selection exercise. We show the performance of the proposed approach on simulated data and on real data sets.",paper present object approach chang point analysi particular look problem two perspect first focus definit object prior number chang point known priori second contribut aim estim number chang point use object approach recent introduc literatur base loss latter consid chang point estim model select exercis show perform propos approach simul data real data set,"['Laurentiu Hinoveanu', 'Fabrizio Leisen', 'Cristiano Villa']","['stat.ME', 'math.ST', 'stat.AP', 'stat.CO', 'stat.ML', 'stat.TH']",False,False,False,True,False,False
1150,2017-03-28T14:04:12Z,2017-03-15T17:03:56Z,http://arxiv.org/abs/1703.05264v1,http://arxiv.org/pdf/1703.05264v1,Smooth Image-on-Scalar Regression for Brain Mapping,smooth imag scalar regress brain map,"Brain mapping is an increasingly important tool in neurology and psychiatry researches for the realization of data-driven personalized medicine in the big data era, which learns the statistical links between brain images and subject level features. Taking images as responses, the task raises a lot of challenges due to the high dimensionality of the image with relatively small number of samples, as well as the noisiness of measurements in medical images.   In this paper we propose a novel method {\it Smooth Image-on-scalar Regression} (SIR) for recovering the true association between an image outcome and scalar predictors. The estimator is achieved by minimizing a mean squared error with a total variation (TV) regularization term on the predicted mean image across all subjects. It denoises the images from all subjects and at the same time returns the coefficient maps estimation. We propose an algorithm to solve this optimization problem, which is efficient when combined with recent advances in graph fused lasso solvers. The statistical consistency of the estimator is shown via an oracle inequality.   Simulation results demonstrate that the proposed method outperforms existing methods with separate denoising and regression steps. Especially, SIR shows an evident advantage in recovering signals in small regions. We apply SIR on Alzheimer's Disease Neuroimaging Initiative data and produce interpretable brain maps of the PET image to patient-level features include age, gender, genotype and disease groups.",brain map increas import tool neurolog psychiatri research realize data driven person medicin big data era learn statist link brain imag subject level featur take imag respons task rais lot challeng due high dimension imag relat small number sampl well noisi measur medic imag paper propos novel method smooth imag scalar regress sir recov true associ imag outcom scalar predictor estim achiev minim mean squar error total variat tv regular term predict mean imag across subject denois imag subject time return coeffici map estim propos algorithm solv optim problem effici combin recent advanc graph fuse lasso solver statist consist estim shown via oracl inequ simul result demonstr propos method outperform exist method separ denois regress step especi sir show evid advantag recov signal small region appli sir alzheim diseas neuroimag initi data produc interpret brain map pet imag patient level featur includ age gender genotyp diseas group,"['Ying Liu', 'Bowei Yan']","['stat.ME', 'stat.AP']",False,False,False,True,False,False
1201,2017-03-28T14:01:45Z,2017-03-27T17:45:07Z,http://arxiv.org/abs/1703.09202v1,http://arxiv.org/pdf/1703.09202v1,Biologically inspired protection of deep networks from adversarial   attacks,biolog inspir protect deep network adversari attack,"Inspired by biophysical principles underlying nonlinear dendritic computation in neural circuits, we develop a scheme to train deep neural networks to make them robust to adversarial attacks. Our scheme generates highly nonlinear, saturated neural networks that achieve state of the art performance on gradient based adversarial examples on MNIST, despite never being exposed to adversarially chosen examples during training. Moreover, these networks exhibit unprecedented robustness to targeted, iterative schemes for generating adversarial examples, including second-order methods. We further identify principles governing how these networks achieve their robustness, drawing on methods from information geometry. We find these networks progressively create highly flat and compressed internal representations that are sensitive to very few input dimensions, while still solving the task. Moreover, they employ highly kurtotic weight distributions, also found in the brain, and we demonstrate how such kurtosis can protect even linear classifiers from adversarial attack.",inspir biophys principl nonlinear dendrit comput neural circuit develop scheme train deep neural network make robust adversari attack scheme generat high nonlinear satur neural network achiev state art perform gradient base adversari exampl mnist despit never expos adversari chosen exampl dure train moreov network exhibit unpreced robust target iter scheme generat adversari exampl includ second order method identifi principl govern network achiev robust draw method inform geometri find network progress creat high flat compress intern represent sensit veri input dimens still solv task moreov employ high kurtot weight distribut also found brain demonstr kurtosi protect even linear classifi adversari attack,"['Aran Nayebi', 'Surya Ganguli']","['stat.ML', 'cs.LG', 'q-bio.NC']",False,False,False,True,False,False
1203,2017-03-28T14:01:45Z,2017-03-27T16:16:35Z,http://arxiv.org/abs/1703.09165v1,http://arxiv.org/pdf/1703.09165v1,PWLS-ULTRA: An Efficient Clustering and Learning-Based Approach for   Low-Dose 3D CT Image Reconstruction,pwls ultra effici cluster learn base approach low dose ct imag reconstruct,"The development of computed tomography (CT) image reconstruction methods that significantly reduce patient radiation exposure while maintaining high image quality is an important area of research in low-dose CT (LDCT) imaging. We propose a new penalized weighted least squares (PWLS) reconstruction method that exploits regularization based on an efficient Union of Learned TRAnsforms (PWLS-ULTRA). The union of square transforms is pre-learned from numerous image patches extracted from a dataset of CT images or volumes. The proposed PWLS-based cost function is optimized by alternating between an image update step, and a sparse coding and clustering step. The CT image update step is accelerated by a relaxed linearized augmented Lagrangian method with ordered-subsets that reduces the number of forward and backward projections. Simulations with 2D and 3D axial CT scans of the XCAT phantom and 3D helical chest scans show that for low-dose levels, the proposed method significantly improves the quality of reconstructed images compared to PWLS reconstruction with a nonadaptive edge-preserving regularizer (PWLS-EP). PWLS with regularization based on a union of learned transforms leads to better image reconstructions than using a single learned square transform or a learned overcomplete synthesis dictionary. We also incorporate patch-based weights in PWLS-ULTRA that enhance image quality and help improve image resolution uniformity.",develop comput tomographi ct imag reconstruct method signific reduc patient radiat exposur maintain high imag qualiti import area research low dose ct ldct imag propos new penal weight least squar pwls reconstruct method exploit regular base effici union learn transform pwls ultra union squar transform pre learn numer imag patch extract dataset ct imag volum propos pwls base cost function optim altern imag updat step spars code cluster step ct imag updat step acceler relax linear augment lagrangian method order subset reduc number forward backward project simul axial ct scan xcat phantom helic chest scan show low dose level propos method signific improv qualiti reconstruct imag compar pwls reconstruct nonadapt edg preserv regular pwls ep pwls regular base union learn transform lead better imag reconstruct use singl learn squar transform learn overcomplet synthesi dictionari also incorpor patch base weight pwls ultra enhanc imag qualiti help improv imag resolut uniform,"['Xuehang Zheng', 'Saiprasad Ravishankar', 'Yong Long', 'Jeffrey A. Fessler']",['stat.ML'],False,False,False,True,False,False
